{
  "name": "Apathy",
  "slug": "apathy",
  "author": "Jannik Siebert (https://github.com/janniks)",
  "background": "#031A16",
  "foreground": "#81B5AC",
  "base16": {
    "color0": "#031A16",
    "color1": "#3E9688",
    "color2": "#883E96",
    "color3": "#3E4C96",
    "color4": "#3E7996",
    "color5": "#4C963E",
    "color6": "#963E4C",
    "color7": "#81B5AC",
    "color8": "#2B685E",
    "color9": "#3E9688",
    "color10": "#883E96",
    "color11": "#3E4C96",
    "color12": "#3E7996",
    "color13": "#4C963E",
    "color14": "#963E4C",
    "color15": "#D2E7E4"
  }
}
