{
  "name": "IR Black",
  "slug": "irblack",
  "author": "Timothée Poisot (http://timotheepoisot.fr)",
  "background": "#000000",
  "foreground": "#b5b3aa",
  "base16": {
    "color0": "#000000",
    "color1": "#ff6c60",
    "color2": "#a8ff60",
    "color3": "#ffffb6",
    "color4": "#e9c062",
    "color5": "#ff73fd",
    "color6": "#c6c5fe",
    "color7": "#b5b3aa",
    "color8": "#6c6c66",
    "color9": "#ff6c60",
    "color10": "#a8ff60",
    "color11": "#ffffb6",
    "color12": "#e9c062",
    "color13": "#ff73fd",
    "color14": "#c6c5fe",
    "color15": "#fdfbee"
  }
}
