{
  "name": "Chalk",
  "slug": "chalk",
  "author": "Chris Kempson (http://chriskempson.com)",
  "background": "#151515",
  "foreground": "#d0d0d0",
  "base16": {
    "color0": "#151515",
    "color1": "#fb9fb1",
    "color2": "#acc267",
    "color3": "#ddb26f",
    "color4": "#eda987",
    "color5": "#e1a3ee",
    "color6": "#12cfc0",
    "color7": "#d0d0d0",
    "color8": "#505050",
    "color9": "#fb9fb1",
    "color10": "#acc267",
    "color11": "#ddb26f",
    "color12": "#eda987",
    "color13": "#e1a3ee",
    "color14": "#12cfc0",
    "color15": "#f5f5f5"
  }
}
