{
  "name": "Github",
  "slug": "github",
  "author": "Defman21",
  "background": "#ffffff",
  "foreground": "#333333",
  "base16": {
    "color0": "#ffffff",
    "color1": "#ed6a43",
    "color2": "#183691",
    "color3": "#795da3",
    "color4": "#0086b3",
    "color5": "#a71d5d",
    "color6": "#183691",
    "color7": "#333333",
    "color8": "#969896",
    "color9": "#ed6a43",
    "color10": "#183691",
    "color11": "#795da3",
    "color12": "#0086b3",
    "color13": "#a71d5d",
    "color14": "#183691",
    "color15": "#ffffff"
  }
}
