{
    "name": "Cyberpunk Night City Mono",
    "slug": "cyberpunk-night-city-mono",
    "author": "xscriptor",
    "base16": {
        "color0": "#07070a",
        "color1": "#fcee0a",
        "color2": "#2a2a2e",
        "color3": "#3a3a40",
        "color4": "#4a4a52",
        "color5": "#00f0ff",
        "color6": "#6a6a72",
        "color7": "#f5f5f5",
        "color8": "#8a8a8b",
        "color9": "#fcee0a",
        "color10": "#2a2a2e",
        "color11": "#3a3a40",
        "color12": "#4a4a52",
        "color13": "#00f0ff",
        "color14": "#6a6a72",
        "color15": "#f5f5f5"
    },
    "background": "#07070a",
    "foreground": "#f5f5f5",
    "roles": {
        "workspaceActive": "#fcee0a",
        "accent": "#fcee0a",
        "accent2": "#00f0ff"
    }
}
