{
  "name": "Atelier Heath",
  "slug": "atelier-heath",
  "author": "Bram de Haan (http://atelierbramdehaan.nl)",
  "background": "#1b181b",
  "foreground": "#ab9bab",
  "base16": {
    "color0": "#1b181b",
    "color1": "#ca402b",
    "color2": "#918b3b",
    "color3": "#bb8a35",
    "color4": "#a65926",
    "color5": "#7b59c0",
    "color6": "#159393",
    "color7": "#ab9bab",
    "color8": "#776977",
    "color9": "#ca402b",
    "color10": "#918b3b",
    "color11": "#bb8a35",
    "color12": "#a65926",
    "color13": "#7b59c0",
    "color14": "#159393",
    "color15": "#f7f3f7"
  }
}
