{
  "name": "OceanicNext",
  "slug": "oceanicnext",
  "author": "https://github.com/voronianski/oceanic-next-color-scheme",
  "background": "#1B2B34",
  "foreground": "#C0C5CE",
  "base16": {
    "color0": "#1B2B34",
    "color1": "#EC5f67",
    "color2": "#99C794",
    "color3": "#FAC863",
    "color4": "#F99157",
    "color5": "#C594C5",
    "color6": "#5FB3B3",
    "color7": "#C0C5CE",
    "color8": "#65737E",
    "color9": "#EC5f67",
    "color10": "#99C794",
    "color11": "#FAC863",
    "color12": "#F99157",
    "color13": "#C594C5",
    "color14": "#5FB3B3",
    "color15": "#D8DEE9"
  }
}
