{
  "name": "Solarized Dark",
  "slug": "solarized-dark",
  "author": "Ethan Schoonover (modified by aramisgithub)",
  "background": "#002b36",
  "foreground": "#93a1a1",
  "base16": {
    "color0": "#002b36",
    "color1": "#dc322f",
    "color2": "#859900",
    "color3": "#b58900",
    "color4": "#cb4b16",
    "color5": "#6c71c4",
    "color6": "#2aa198",
    "color7": "#93a1a1",
    "color8": "#657b83",
    "color9": "#dc322f",
    "color10": "#859900",
    "color11": "#b58900",
    "color12": "#cb4b16",
    "color13": "#6c71c4",
    "color14": "#2aa198",
    "color15": "#fdf6e3"
  }
}
