{
  "name": "Rebecca",
  "slug": "rebecca",
  "author": "Victor Borja (http://github.com/vic) based on Rebecca Theme (http://github.com/vic/rebecca-theme)",
  "background": "#292a44",
  "foreground": "#f1eff8",
  "base16": {
    "color0": "#292a44",
    "color1": "#a0a0c5",
    "color2": "#6dfedf",
    "color3": "#ae81ff",
    "color4": "#efe4a1",
    "color5": "#7aa5ff",
    "color6": "#8eaee0",
    "color7": "#f1eff8",
    "color8": "#666699",
    "color9": "#a0a0c5",
    "color10": "#6dfedf",
    "color11": "#ae81ff",
    "color12": "#efe4a1",
    "color13": "#7aa5ff",
    "color14": "#8eaee0",
    "color15": "#53495d"
  }
}
