{
  "name": "Bright",
  "slug": "bright",
  "author": "Chris Kempson (http://chriskempson.com)",
  "background": "#000000",
  "foreground": "#e0e0e0",
  "base16": {
    "color0": "#000000",
    "color1": "#fb0120",
    "color2": "#a1c659",
    "color3": "#fda331",
    "color4": "#fc6d24",
    "color5": "#d381c3",
    "color6": "#76c7b7",
    "color7": "#e0e0e0",
    "color8": "#b0b0b0",
    "color9": "#fb0120",
    "color10": "#a1c659",
    "color11": "#fda331",
    "color12": "#fc6d24",
    "color13": "#d381c3",
    "color14": "#76c7b7",
    "color15": "#ffffff"
  }
}
