{
  "name": "Gruvbox light, hard",
  "slug": "gruvbox-light-hard",
  "author": "Dawid Kurek (dawikur@gmail.com), morhetz (https://github.com/morhetz/gruvbox)",
  "background": "#f9f5d7",
  "foreground": "#504945",
  "base16": {
    "color0": "#f9f5d7",
    "color1": "#9d0006",
    "color2": "#79740e",
    "color3": "#b57614",
    "color4": "#af3a03",
    "color5": "#8f3f71",
    "color6": "#427b58",
    "color7": "#504945",
    "color8": "#bdae93",
    "color9": "#9d0006",
    "color10": "#79740e",
    "color11": "#b57614",
    "color12": "#af3a03",
    "color13": "#8f3f71",
    "color14": "#427b58",
    "color15": "#282828"
  }
}
