{
  "name": "Atelier Cave",
  "slug": "atelier-cave",
  "author": "Bram de Haan (http://atelierbramdehaan.nl)",
  "background": "#19171c",
  "foreground": "#8b8792",
  "base16": {
    "color0": "#19171c",
    "color1": "#be4678",
    "color2": "#2a9292",
    "color3": "#a06e3b",
    "color4": "#aa573c",
    "color5": "#955ae7",
    "color6": "#398bc6",
    "color7": "#8b8792",
    "color8": "#655f6d",
    "color9": "#be4678",
    "color10": "#2a9292",
    "color11": "#a06e3b",
    "color12": "#aa573c",
    "color13": "#955ae7",
    "color14": "#398bc6",
    "color15": "#efecf4"
  }
}
