{
  "name": "Espresso",
  "slug": "espresso",
  "author": "Unknown. Maintained by Alex Mirrington (https://github.com/alexmirrington)",
  "background": "#2d2d2d",
  "foreground": "#cccccc",
  "base16": {
    "color0": "#2d2d2d",
    "color1": "#d25252",
    "color2": "#a5c261",
    "color3": "#ffc66d",
    "color4": "#f9a959",
    "color5": "#d197d9",
    "color6": "#bed6ff",
    "color7": "#cccccc",
    "color8": "#777777",
    "color9": "#d25252",
    "color10": "#a5c261",
    "color11": "#ffc66d",
    "color12": "#f9a959",
    "color13": "#d197d9",
    "color14": "#bed6ff",
    "color15": "#ffffff"
  }
}
