{
  "name": "Atelier Dune",
  "slug": "atelier-dune",
  "author": "Bram de Haan (http://atelierbramdehaan.nl)",
  "background": "#20201d",
  "foreground": "#a6a28c",
  "base16": {
    "color0": "#20201d",
    "color1": "#d73737",
    "color2": "#60ac39",
    "color3": "#ae9513",
    "color4": "#b65611",
    "color5": "#b854d4",
    "color6": "#1fad83",
    "color7": "#a6a28c",
    "color8": "#7d7a68",
    "color9": "#d73737",
    "color10": "#60ac39",
    "color11": "#ae9513",
    "color12": "#b65611",
    "color13": "#b854d4",
    "color14": "#1fad83",
    "color15": "#fefbec"
  }
}
